name,club,total,p1,p2,p3,p4,p5,p6,p7,p8
Tveit Muskantor Leah, Köpings BTK,48,21,,18,9,,,,
Baasan Nomin, Eslövs AI BTK,46,5,28,,13,,,,
Hansson Matilda, Eslövs AI BTK,39,,,18,21,,,,
Tveit Muskantor Rebecca, Eslövs AI BTK,36,,,36,,,,,
Holgersson Hanna, IK Juno,33,,,24,9,,,,
Olsson Linn, BTK Frej,27,3,13,9,5,,,,
Johansson Linnea, Spårvägens BTK,23,5,13,,5,,,,
Hansen Maja Helene, OB Bordtennis,21,,18,3,,,,,
Händén Anja, Västers BTK,18,9,4,,5,,,,
Kalvatn Christine, Fokus BTK,16,13,,,3,,,,
Kelly Danielle, IK Juno,14,,4,9,1,,,,
Rosager Christensen Ann-Christine, Viby BTK,14,2,7,5,,,,,
Stoffregen Mille, Silkeborg BTK,14,9,,5,,,,,
Nilsson Alice, Våxtorps BOIS,13,,7,5,1,,,,
Axelsson Sandra, Eslövs AI BTK,10,5,1,3,2,,,,
Eriksson Sofia, BTK Rekord,10,3,2,5,2,,,,
Fred Josephina, Mariedals IK,10,,,9,1,,,,
Jetha Sienna, England,9,,4,,5,,,,
Maribo Sally, BTK Viby,9,3,1,5,,,,,
Nurga Raili, Sport Club Pinx,9,,,9,,,,,
Haagensen Jocefina, Hvidovre Bordtennis,8,5,,3,,,,,
Ronnebring Tuva, Kosta SK,8,,7,,1,,,,
Oredsson Tuva, Halmstad BTK,7,,4,3,,,,,
Svensson Agnes, Halmstad BTK,7,,7,,,,,,
Svensson Lina, Halmstad BTK,7,,4,3,,,,,
Kullingsjö Isabelle, IFK Falköping BTK,6,3,1,2,,,,,
Natanaelsson Moa, Spårvägens BTK,6,3,1,2,,,,,
Hellström Ida, Ängby SK,5,,,5,,,,,
Johansson Emilia, Sjömarkens BTK,5,3,2,,,,,,
Sadikovic Melisa, Luxembourg,5,,,5,,,,,
Zajac Anna, Tibble-Kungsängen BTK,5,,,5,,,,,
Baig Maliha, England,4,,4,,,,,,
Pashley Ella, England,4,,4,,,,,,
Shute Mabel, England,4,,4,,,,,,
Dumont Tessy, Luxembourg,3,,,3,,,,,
Eckeroth Sofia, Denmark,3,,,3,,,,,
Flor Wilhemsen Susanne, Trondheim BTK,3,,,3,,,,,
Girlea Maria, Finland,3,,,3,,,,,
Hejdebäck Emilia, Gefle PK,3,,,3,,,,,
Ikkonen Eiris, LTK Kalev,3,,,3,,,,,
Mariott Amy, England,3,,,,3,,,,
Mitt Maia, LTK Kalev,3,,,3,,,,,
Riina Hanson Katrin, LTK Kalev,3,,,3,,,,,
Skjøld Hinze Filippa, Fokus BTK,3,3,,,,,,,
Stahle Ohlin Klara, Spårvägens BTK,3,,,3,,,,,
Söderlund Elvira, Sjömarkens BTK,3,3,,,,,,,
Vendelbo Emma, Denmark,3,,,3,,,,,
Jones Megan, England,2,,1,,1,,,,
Wålme Malva, Askims BTK,2,2,,,,,,,
Dittlau Hannah, IFK Täby BTK,1,,1,,,,,,
Urbonaite Vaiva, Åstorps BTK,1,,1,,,,,,