name,club,total,p1,p2,p3,p4,p5,p6,p7,p8
Gravsiö Wallin Adam, IFK Täby BTK,204,55,39,31,,31,,48
Jobs Hugo, Ängby SK,155,31,5,16,45,12,31,20
Madhu Chandra Bharath, Spårvägens BTK,131,9,55,16,,12,,39
Hedblad Sigge, IFK Täby BTK,114,9,31,9,,45,,20
Sjösvärd Melker, Linköpings Pingisklubb,114,16,16,39,12,,24,7
Geijer Axel, KFUM Jönköping IA,113,9,5,16,31,7,45,4
Gjörling Emil, Ängby SK,107,16,16,31,,12,12,20
Alvendal Theo, Norrtulls SK,92,39,16,,12,7,7,11
Ståhl Olle, Ängby SK,82,9,5,9,,24,24,11
Enbom Noah, Carlshamns BTK,77,9,16,9,24,7,12,7
Usov Mark, Haparanda SKT,75,31,,9,,24,,11
Kingham Issac, England,70,,31,,,,,39
Lapinat Hugo, Region Alpes Cote d'Azur,66,,,,,,,66
Piilola Mio, BTK Frej,62,16,9,5,7,12,7,11
Abramov Natanael, Rishon LeZion,55,,,55,,,,
EngbergHavsteen Johan, Åstorps BTK,53,16,9,9,,,12,7
Hallberg Leon, Halmstad BTK,43,9,5,3,12,7,7,
Larsson Vidar, Uppsala BTK,38,5,9,3,7,,7,7
Larsson Sebastian, Spårvägens BTK,37,5,9,9,7,,,7
Röhr Jack, Spårvägens BTK,37,9,9,5,7,,,7
Bröms August, Norrtulls SK,30,5,5,5,4,7,4,
Bozanovic Emilio, BTK Rekord,29,5,5,5,,7,7,
Sellado Abraham, England,28,,,,24,,,4
Johansson Melker, Norrtulls SK,27,5,9,5,,4,4,
Høier Erik, Bronshoj,26,5,,9,,,12,
Leth Nottelmann Adam, Brønshøj,26,9,5,5,,,7,
Severinsen Malik, ESBJERG,26,5,5,5,7,,4,
Hermann Magne, Lekstorps IF,25,5,3,2,4,7,,4
AhKing Lo, Hammarby IF BTF,23,5,,,,7,7,4
Hasselbalch Emil, Virum/Sorgenfri BTK,23,3,9,3,4,,4,
Kongsdal Andreas, Vestegnen BTK,22,5,5,1,7,,4,
Ahrenholt Jensen Marcus, Hilleröd Bordtennis,20,,5,3,4,,4,4
Champauzas Maxence, Region Alpes Cote d'Azur,20,,,,,,,20
Karlsson Englund Simon, Spårvägens BTK,20,,5,5,4,4,,2
Lehtola Lassi, Finland,20,,,16,,,,4
Petersson Tintin, IFK Klagshamn,20,3,5,,4,4,4,
Ellermann Emil, Västers BTK,19,2,3,3,,4,,7
Myrhage Axel, Askims BTK,19,5,5,3,2,4,,
Radiven Max, England,19,,,,12,,,7
Ingeström Albin, Ängby SK,18,3,3,2,,2,4,4
Törnkvist Hampus, Halmstad BTK,18,2,3,1,4,4,4,
Claeson Felix, IFK Lund Bordtennis,17,5,,,4,4,4,
Lundh Gabriel, Spårvägens BTK,17,3,5,5,,,,4
Boberg Nils, IFK Klagshamn,16,,3,2,7,2,2,
Engström Alexander, Hammarby IF BTF,16,5,,2,4,4,,1
Sahr Aaron, Luxembourg,16,,,9,,,,7
Wirk Nikolaj, Vestegnen BTK,16,5,3,,4,,4,
Fischer Mio, Norrtulls SK,15,2,5,2,1,,1,4
Sträm Jacob, Ängby SK,14,3,1,5,,4,,1
Jerdborg Love, Lekstorps IF,13,,3,,2,4,,4
Martinsson Hugo, Lekstorps IF,13,1,3,,1,2,2,4
Adolphson Noa, Spårvägens BTK,12,,3,2,,,,7
Bjerke Ebbe, BTK Safir,12,3,,2,,,,7
Hjertman Ruben, Spårvägens BTK,12,2,1,1,4,,,4
Salmi Lenny, Västerås BTK,12,,,5,,,,7
Svedlund Ivan, Spårvägens BTK,12,5,3,,,,,4
Alibai Adam, Fusion TTC,11,,,,,,,11
Appelros Elias, Carlshamns BTK,11,3,3,,1,2,1,1
Carlsson Hannes, KFUM Kristianstad BTF,11,2,1,,2,2,4,
Cavaille Sandro, Region Alpes Cote d'Azur,11,,,,,,,11
Elebring Felix, Linköpings Pingisklubb,11,2,,5,,,4,
Frøseth Jonas, Tingvoll BTK,11,3,,,,,4,4
Grahn Skoog Theo, Böksholms IF,11,,3,3,2,,2,1
Hallén Zac, Trelleborgs BTK,11,,3,2,4,,2,
Norburg Harald, Ängby SK,11,,3,2,,4,2,
Pattison Ralph, England,11,,,,,,,11
Piwowar Kacper, England,11,,,,,,,11
Randall Harry, England,11,,,,7,,,4
Blecher Bruno, Norrtulls SK,10,1,3,,,2,,4
Bölenius Pontus, Boo KFUM IA,10,,3,1,2,2,2,
Haegerstam Hampus, Linköpings PK,10,,,3,,,7,
Mattsson Anton, Lyckeby BTK,10,1,3,,4,,2,
Blom Jonathan, Frederiksbergs Bordtennisklub,9,,9,,,,,
Eineving Karl, Mölndals BTK,9,1,3,,,4,,1
Pham Johnny, IFK Täby BTK,9,2,,1,2,2,1,1
Phan William, IFK Klagshamn,9,,1,,4,,4,
Rengbrandt Lucas, Trelleborgs BTK,9,1,3,2,1,1,1,
Eriksson Antony, TibbleKungsängen BTK,8,,3,2,,,2,1
Forsberg Carl, Lekstorps IF,8,2,,,,,2,4
Højslet Gustav, Ribe BTK,8,3,5,,,,,
Strand Alvar, Solna BTK,8,,,2,2,4,,
Troske Elliott, Ängby SK,8,2,1,1,,2,1,1
Af Winklerfelt Axel, Trelleborgs BTK,7,2,1,,2,,2,
Appelgren Isac, Lekstorps IF,7,1,3,,,2,,1
Drake Leonard, Svanesunds GIF,7,,3,,,4,,
Durakovic Neo, BTK Safir,7,,,3,,,,4
Isaksson Joel, Vetlanda BTK,7,,,,,,,7
Johansson Kenneth, Rotebro BTK,7,3,,,,,,4
Lambinet Noah, Luxembourg,7,,,3,,,,4
Lavanant Esteban, Region Alpes Cote d'Azur,7,,,,,,,7
Mortensen Petter, Norge,7,,,,,,,7
Nizio Zbigniew, Region Alpes Cote d'Azur,7,,,,,,,7
Olsson Frank, Spårvägens BTK,7,1,3,1,1,,,1
Olsson William, Söderhamns UIF,7,5,,1,,,,1
Tang Dylan, Fokus BTK,7,2,,,1,,,4
Åkerstedt Filip, Karlsborgs BTK,7,,3,3,,1,,
Andrae Jacob, Malmö IF,6,3,1,,,,2,
Koivumäki Jimi, TIP70 Finland,6,,,2,,,,4
Nilsson Oscar, BTK Frej,6,,1,,2,1,2,
Pelles Alexander, Norrtulls SK,6,,,2,,2,2,
Stucki Harry, Hammarby IF BTF,6,2,,2,,2,,
Svanström Alvin, Lyckeby BTK,6,1,3,,1,,1,
Tibblin Emil, Stratos Enköping BTK,6,,,2,,,,4
Zhu William, Spårvägens BTK,6,,,5,,,,1
Appelblad Christensen Hugo, IFK Täby BTK,5,,,3,,2,,
Asterhed Arvid, Lyckeby BTK,5,2,1,,1,,,1
Brandt Edvard, Rotebro BTK,5,1,,,,,,4
Bravo Eliah, Upplands Väsby BTK,5,,3,1,,,,1
Fredriksson Albin, Spårvägens BTK,5,,,1,,,,4
Fuchs Matan, Rishon LeZion,5,,,5,,,,
Grunfeld Tomy, Rishon LeZion,5,,,5,,,,
Gustafsson Gunnar, Boo KFUM IA,5,,,1,,2,2,
Holkedahl Erik, Rotebro BTK,5,1,,,,,,4
Koch Liedes Alexander, Horreds BTK,5,1,3,,,1,,
Lindahl Linus, Dänningelanda BTK,5,,,3,,,,2
Persson Melker, Trelleborgs BTK,5,2,1,,1,,1,
Rosenberg Bergholt Villads, Hvidovre Bordtennis,5,,1,2,2,,,
Rusinovs Maksims, Latvia,5,,,1,,,,4
Sandström Malte, IFK Täby BTK,5,,,1,,4,,
Sivertsen Fredrik, Fokus BTK,5,,,,4,,,1
Thomas Türi Frank, LTK Kalev,5,,,5,,,,
Tolinsson Elliot, Solna BTK,5,3,,2,,,,
Arvidsson Ture, Linköpings Pingisklubb,4,2,,,,,2,
Bartholomausen Victor, Amager BTK,4,,,,,,4,
Bigander Vincent, Rotebro BTK,4,3,,,,,,1
Candida Leonardo, Milano TTC Academy,4,,,,,,,4
Cartau Lois, Region Alpes Cote d'Azur,4,,,,,,,4
Figuiere Fabre Quintin, Region Occitanie,4,,,,,,,4
Frizzera Federico, Milano TTC Academy,4,,,,,,,4
Häggström Nils, Spårvägens BTK,4,,,2,1,,,1
Johansson Liam, IFK Lidköping,4,,,,,4,,
Puleo Achille, Milano TTC Academy,4,,,,,,,4
Saeby Lauritsen Aksel, Roskilde BTK,4,,,,4,,,
Dommermuth Sivertsen Fredrik, Fokus BTK,3,3,,,,,,
Gustafsson Åmark Arvid, Mölndals BTK,3,1,1,,,1,,
Höij Axel, Ängby SK,3,,,3,,,,
Johansson Gustav, Fokus BTK,3,1,,,1,,,1
Luks Arturs, Latvia,3,,,2,,,,1
Lydén Lindblom Arvid, IFK Täby BTK,3,2,,1,,,,
Månsson Christos, BTK Rekord,3,,1,,,,2,
Terentjevs Kirils, Latvia,3,,,3,,,,
Theisen Max, Luxembourg,3,,,3,,,,
Werkström Felix, Lyckeby BTK,3,,1,,1,,1,
Wicktor Alexander, Trelleborgs BTK,3,,1,,1,,1,
Zmara Vito, Ortvikens PK,3,,1,2,,,,
Brouwer Didrik, Mölndals BTK,2,1,,,,1,,
Farnes Michael, Norge,2,,,,,,,2
Freij Kelvered Oliver, Mölndals BTK,2,1,,,,1,,
Gran Victor, Åsa IF,2,1,1,,,,,
Haglund Loke, BTK Safir,2,,,,,,,2
Hassellöv Trond, Svanesunds GIF,2,,,,,2,,
Kraiko Martin, LTK Kalev,2,,,2,,,,
Kruse Gustav, Hammarby IF BTF,2,,,,,2,,
Kuivinen Henry, Hammarby IF BTF,2,,,1,,,1,
Leigert Adam, Mölndals BTK,2,,,,,2,,
Nordman Måns, Solna BTK,2,,,2,,,,
Oinas Luka, OPT86,2,,,2,,,,
Oskarsson David, Eslövs AI BTK,2,1,1,,,,,
Razi Siddiqi Bassam Babar, Roskilde BTK,2,,,,2,,,
Stahl Eriksen Felix, VirumSorgenfri BTK,2,,1,,1,,,
Swedmark Torsten, Boo KFUM IA,2,,,,,2,,
Taherinasab Arvin, Mariedals IK,2,,,,,2,,
Tang Emil, Amager BTK,2,,,,,,2,
Asp Albin, Norrtälje BTK,1,,,,1,,,
Björk Hugo, Vaggeryds BTK,1,,1,,,,,
Christensen Gustav, Vestegnen BTK,1,,,,,,1,
Emanuels Pupins Benjamins, Latvia,1,,,1,,,,
Eriksson Nicholas, IFK Täby BTK,1,,,,,,,1
Erlandsen Niklas, Fokus BTK,1,1,,,,,,
Escudier Tim, Region Alpes Cote d'Azur,1,,,,,,,1
Forno Giacomo, Milano TTC Academy,1,,,,,,,1
Färdigh Felix, Gefle PK,1,,,,,,,1
Gjörser Jacobsson Beppe, IFK Österåkers BTK,1,,,,,,,1
Gomejzon Benjamin, Boo KFUM IA,1,,,,,1,,
Hansson Albin, Sandareds BTK,1,,,,,1,,
Harwood Toby, Wales,1,,,,,,1,
Hobeoja Ottomar, LTK Kalev,1,,,1,,,,
Hultin Felix, Mariedals IK,1,,,,,1,,
Häggander Melker Svenesunds GIF,1,,1,,,,,
Isaksson John, Kungsbacka BTK,1,1,,,,,,
Itzik Roi, Haifa,1,,,1,,,,
Kozintesev Enrico, LTK Kalev,1,,,1,,,,
Laudams Rodrigo, Latvia,1,,,,,,,1
Lindberg Schröder Helmer, IFK Österåkers BTK,1,,,,,,,1
Milberg Aslan, Vestegnen BTK,1,,,,,,1,
Patjas Elias, Ängby SK,1,,,1,,,,
Puljer Torsten, Ortvikens PK,1,,,1,,,,
Pupins Benjamins, Latvia,1,,,,,,,1
Ralfs Zeme Aleksis, Latvia,1,,,1,,,,
Rydell Mio, Munkedals BTK,1,,,,,1,,
Saksinen Sam, Värmskogs SK,1,,,,,,,1
Sandberg Algot, Trelleborgs BTK,1,,1,,,,,
Sharon Harel, Rishon LeZion,1,,,1,,,,
Vallevi Swiderski Dominik, Lyckeby BTK,1,,,,1,,,
Venevi Sebastian, Trelleborgs BTK,1,,,,,,1,
Westblad Otto, BTK Rekord,1,,,,,,1,
Zeme Aleksis, Latvia,1,,,,,,,1
Zubkov Kirill, LTK Kalev,1,,,1,,,,